,content,Type,sentiment,preprocessed,pos_tags
0,Был ненаход (клад похоронили под слоем бетона). Но максимально вежливая поддержка и купончики от магазина порешали все вопросы! 10/10,А,1,ненаход клад похоронить слой бетон максимально вежливый поддержка купончик магазин порешать всё вопрос,VERB NOUN NOUN VERB ADP NOUN NOUN CCONJ ADV ADJ NOUN CCONJ NOUN ADP NOUN VERB DET NOUN NUM NUM
1,"10/10/10 хорошая прогулка, за хорошим феном. До новых встреч!",А,1,хороший прогулка хороший фен новый встреча,NUM NUM NUM ADJ NOUN ADP ADJ NOUN ADP ADJ NOUN
2,"Дома,соточки по всем параметрам,спасибо всей команде.РЕКОМЕНДУЮ ДАННЫЙ ШОП,перебрал много магазов,достойное качество только тут.Еще зайду)Не откажусь от купона))Всем добра.",А,1,дом соточка весь параметр спасибо весь команда рекомендовать данный шоп перебрать магаз достойный качество ещё зайти отказаться купон весь добро,ADV NOUN ADP DET NOUN NOUN DET ADJ ADJ PROPN VERB ADV NOUN ADJ NOUN PART NOUN ADV VERB PART VERB ADP NOUN DET NOUN
3,"Все супер, квест момент, Стафф как надо!",А,1,всё супер квест момент стаффа,PRON NOUN NOUN NOUN PROPN ADV ADV
4,всё хорошо,А,1,всё,PRON ADJ
5,"Касание, всё как обычно. Купил забрал сожрал)))10.10.10",А,1,касание всё обычно купить забрать сожрать,NOUN PRON SCONJ ADV VERB VERB VERB NUM
6,"В общем, видимо, в момент когда я решил сделать тут заказ, я попал в параллельную вселенную где все четко быстро и восторженные отзывы на странице действительно правда. Передам Вам свой опыт через этот отзыв. В общем в очередной раз, в попыхах пытаясь закинуть деньги на очередную покупку, я не рассчитал комиссии и тд, и в итоге не хватало 0.00002(это 70р по курсу, или чуть больше 100 через обмен на гидре) вонючих битка на 2гр клад. Так как я наркоман и денег у меня мало, пишу магазину с просьбой о купоне на эту сумму, получаю ответ в течении 10(!!!!!!!) минут с купоном на 150 рубасов. На радостях покупаю закладулю и еду за ним. Здесь оч крутой тайник и все ясно и понятно, от курьера 4(!) фотографии с места, панорамные где видно как туда пройти, и вблизи с точно указанной точкой где лежит. Все в хорошем качестве, и сверху еще развернутое описание текстом. Кароче, я приехал уже стемнело, и на месте почти нет уличного света, я сразу же сориентировался(благ. фоткам курьера) и просто в абсолютной темени без фонарика в касание снял заклад сунув просто руку туда куда указано, чуть ли не на ходу. Упаковка добротная, по весу на глаз правда 2гр есть, тайник оч крутой, беспалевный. По качеству, можно судить по тому сколько я написал уже ;), ну и правда качество здесь очень даже ок. В общем спасибо! Еще вернусь сюда. Итак джентльмены, отписал магазину в ЛС за призом за ежедневный конкурс, выдали купон на 1000 рублей, если это не рай, то что тогда вообще?! :) ",А,1,общий видимо момент решить сделать заказ попасть параллельный вселенная всё чётко быстро восторженный отзыв страница действительно правда передать свой опыт отзыв общий очередной попых пытаться закинуть деньга очередной покупка рассчитать комиссия тд итог хватать это 70р курс большой обмен гидра вонючий биток 2гр клад наркоман деньга мало писать магазин просьба купон сумма получать ответ течение минута купон рубасовый радость покупать закладуля еда оч крутой тайник всё ясно понятно курьер фотография место панорамный видно туда пройти вблизи точно указанный точка лежать всё хороший качество сверху ещё развернуть описание текст кароч приехать стемнеть место уличный свет сразу сориентироваться благо фотка курьер просто абсолютный темя фонарик касание снять заклад сунуть просто рука туда указать ход упаковка добротный вес глаз правда 2гр тайник оч крутой беспалевный качество судить сколько написать правда качество очень около общий спасибо ещё вернуться сюда итак джентльмен отписать магазин лс приз ежедневный конкурс выдать купон рубль это рай вообще,ADP ADJ ADV ADP NOUN SCONJ PRON VERB VERB ADV NOUN PRON VERB ADP ADJ NOUN ADV PART ADV ADV CCONJ ADJ NOUN ADP NOUN ADV ADV VERB PRON DET NOUN ADP DET NOUN ADP ADJ ADP ADJ NOUN ADP NOUN VERB VERB NOUN ADP ADJ NOUN PRON PART VERB NOUN CCONJ NOUN CCONJ ADP NOUN PART VERB NUM PRON NOUN ADP NOUN CCONJ ADV ADV NUM ADP NOUN ADP NOUN ADJ NOUN ADP NUM NOUN ADV SCONJ PRON NOUN CCONJ NOUN ADP PRON ADV VERB NOUN ADP NOUN ADP NOUN ADP DET NOUN VERB NOUN ADP NOUN NUM NOUN ADP NOUN ADP NUM NOUN ADP NOUN VERB NOUN CCONJ NOUN ADP PRON ADV ADV ADJ NOUN CCONJ PRON ADJ CCONJ ADJ ADP NOUN NUM NOUN ADP NOUN ADJ ADV ADV ADV ADV VERB CCONJ ADV ADP ADV VERB NOUN ADV VERB PRON ADP ADJ NOUN CCONJ ADV ADV VERB NOUN NOUN INTJ PRON VERB ADV VERB CCONJ ADP NOUN ADV VERB ADJ NOUN PRON ADV PART VERB NOUN NOUN NOUN CCONJ PART ADP ADJ NOUN ADP NOUN ADP NOUN VERB ADV VERB PART NOUN ADV ADV VERB ADV PART PART ADP NOUN NOUN ADJ ADP NOUN ADP NOUN NOUN PROPN VERB NOUN ADV ADJ ADJ ADP NOUN ADV VERB ADP PRON NUM PRON VERB ADV PART CCONJ ADV NOUN ADV ADV PART NOUN ADP ADJ NOUN ADV VERB ADV ADV NOUN VERB NOUN ADP PROPN ADP NOUN ADP ADJ NOUN VERB NOUN ADP NUM NOUN SCONJ PRON PART NOUN SCONJ PRON ADV ADV
7,"В касание, стафф хороший!",А,1,касание стаффа хороший,ADP NOUN NOUN ADJ
8,"Всё отлично, магазину процветания! Качество огонь! Только место не удачное рядом с отделом полиции!) много экипажей проехало, пришлось долго сидеть в тачке выжидать! ",А,1,всё отлично магазин процветание качество огонь место удачный рядом отдел полиция экипаж проехать прийтись долго сидеть тачка выжидать,PRON ADJ NOUN NOUN NOUN NOUN PART NOUN PART ADJ ADV ADP NOUN NOUN ADV NOUN VERB VERB ADV VERB ADP NOUN VERB
9,"В касание. Всё чётко, как всегда) магазину КМ респект)",А,1,касание всё чётко магазин км респект,ADP NOUN PRON ADJ SCONJ ADV NOUN NOUN NOUN
10,"Ну вот я не понимаю, почему остальные магазины не могут так четко работать!!!!!! Приятно удивляюсь. Кура молодчик, всем советую, не зря магаз первый в списке всегда",А,1,понимать почему остальной магазин мочь чётко работать приятно удивляться кура молодчик весь советовать зря магаз первый список,PART PART PRON PART VERB ADV ADJ NOUN PART VERB ADV ADV VERB ADV VERB NOUN NOUN PRON VERB PART ADV NOUN ADJ ADP NOUN ADV
11,"Качество не топ, но своих денег стоит. Найдено без проблем.",А,1,качество топ свой деньга стоить найти проблема,NOUN PART NOUN CCONJ DET NOUN VERB VERB ADP NOUN
12,"Клад — надёжный, места — живописные, комары — пидарасы. ГэнгБэнг как всегда: дорого, но охуенно. ",А,1,клад надёжный место живописный комар пидарас гэнгбэнг дорого охуенно,NOUN ADJ NOUN ADJ NOUN NOUN NOUN SCONJ ADV ADJ CCONJ ADJ
13,"есто найдено быстро, спрятано хорошо. Специфический запах и влага в пакете, испаряется моментально при попадании воздуха. В целом стафф рабочий. Всем респект.",А,1,есто найти быстро спрятать специфический запах влага пакет испаряться моментально попадание воздух целое стаффа рабочий весь респект,NOUN VERB ADV VERB ADJ ADJ NOUN CCONJ NOUN ADP NOUN VERB ADV ADP NOUN NOUN ADP NOUN NOUN ADJ PRON NOUN
14,"снято в касание, стафф как всегда бомба! беру не первый раз. доволен",А,1,снятой касание стаффа бомба брать первый довольный,VERB ADP NOUN NOUN SCONJ ADV NOUN VERB PART ADJ NOUN ADJ
15,"Клад в касание, стафф слабоват. UPD: он не слаб, а просто действует более мягко. Приятный и хороший стим без перегибов и сильных танцев челюстью. Отлично. ",А,1,клад касание стаффа слабоватый upd слабый просто действовать мягко приятный хороший стим перегиб сильный танец челюсть отлично,NOUN ADP NOUN NOUN ADJ PROPN PRON PART ADJ CCONJ PART VERB ADV ADV ADJ CCONJ ADJ NOUN ADP NOUN CCONJ ADJ NOUN NOUN ADJ
16,"В данном шопе работают адекватные ответливые люди, идут на встречу и всегда онлайн Работу данного шопа рекомендую смело.",А,1,данный шоп работать адекватный ответливый человек идти встреча онлайн работа данный шоп рекомендовать смело,ADP ADJ NOUN VERB ADJ ADJ NOUN VERB ADP NOUN CCONJ ADV VERB PROPN ADJ NOUN VERB ADV
17,"Всё хорошо! Был сначала ненаход, но магазин выслушал меня и выдал другой адрес. Вообще, всё на уровне, обращайтесь сюда и качество и условия достойные! 10/10/10 ",А,1,всё сначала ненаход магазин выслушать выдать адрес вообще всё уровень обращаться сюда качество условие достойный,PRON ADJ AUX ADV NOUN CCONJ NOUN VERB PRON CCONJ VERB ADJ NOUN ADV PRON ADP NOUN VERB ADV CCONJ NOUN CCONJ NOUN ADJ NUM NUM NUM
18,Как всегда все четко!!! 10/10/10,А,1,всё чётко,ADV ADV PRON ADJ NUM NUM NUM
19,"Снят в касание. Стафф без запаха и вкуса, сначала подумал что наебалово, но после двух дорог распидорасило конкретно. КМ красава, такого четкого описания я нигде не видел. Правда далековато было идти. В целом покупкой очень доволен. По всем пунктам 10 баллов. Обязательно загляну в этот магазин еще не раз! Всем удачи, а магазину процветания!",А,1,снятой касание стаффа запах вкус сначала подумать наебаловый дорога распидорасить конкретно км красава чёткий описание нигде видеть правда далековато идти целое покупка очень довольный весь пункт балл обязательно заглянуть магазин ещё весь удача магазин процветание,VERB ADP NOUN NOUN ADP NOUN CCONJ NOUN ADV VERB PRON ADV CCONJ ADP NUM NOUN VERB ADV NOUN NOUN DET ADJ NOUN PRON ADV PART VERB ADV ADJ AUX VERB ADP NOUN NOUN ADV ADJ ADP DET NOUN NUM NOUN ADV VERB ADP DET NOUN ADV PART NOUN DET NOUN CCONJ NOUN NOUN
20,"Все супер, возникли трудности. Магазин пошел на уступки! Стаф",А,1,всё супер возникнуть трудность магазин пойти уступка стафа,PRON NOUN VERB NOUN NOUN VERB ADP NOUN NOUN
21,Всё супер. Добра всем)),А,1,всё супер добро весь,PRON NOUN NOUN PRON
22,"Был не наход и крайне долгий диспут, но по результату пришли к решению. В целом всё норм",А,1,наход крайне долгий диспут результат прислать решение целое всё норма,AUX PART ADJ CCONJ ADV ADJ NOUN CCONJ ADP NOUN VERB ADP NOUN ADP NOUN DET NOUN
23,"Место 10,упаковка 10, качество достойное",А,1,место упаковка качество достойный,NOUN NOUN NUM NOUN ADJ
24,"Все гуд. только, лево и право перепутал. А так гуд. По качеству вроде норм. без лихних запахов и вкусов.",А,1,всё гуд левый право перепутать гуд качество вроде норма лихний запах вкус,PRON VERB PART ADV CCONJ NOUN VERB CCONJ ADV NOUN ADP NOUN ADP NOUN ADP ADJ NOUN CCONJ NOUN
25,"Всё нашлось, квест интересный, км красава. 7 баллов из-за меньшего веса чем заявлено, ровно 5 вместе с жиром, в остальном всё отлично!",А,1,всё найтись квест интересный км красава балл малый вес заявить ровно вместе жир остальной всё отлично,PRON VERB NOUN ADJ NOUN NOUN NUM NOUN ADP ADJ NOUN SCONJ VERB ADV NUM ADV ADP NOUN ADP ADJ PRON ADJ
26,"Место топчик,а став на 3 балла из 10",А,1,место топчик стать балл,NOUN NOUN CCONJ VERB ADP NUM NOUN ADP NUM
27,"На самом видном месте разместили! Возле лодочной станции ! Никогда больше там не закладывайте! Там куча людей, детей. Кладмену не зачёт!",А,1,видный место разместить возле лодочный станция большой закладывать куча человек ребёнок кладмена зачёт,ADP ADJ ADJ NOUN VERB ADP ADJ NOUN ADV ADV ADV PART VERB ADV NOUN NOUN NOUN NOUN PART NOUN
28,"Бляяя! Чувакиии! Стафф просто чумавой! 10 из 10! По самым строгим меркам! Камни твёрдые как орех! Заходит как к себе домой! Ничего не жжёт! Нет противного запаха. Цвет белоснежный! Советую брать большой вес. Там и камни покрупнее и в деньгах выгоднее! Кладмену РЕСПЕКТ отдельный все по полочкам разложил. С забором вообще не бывает проблем в этом магазине! Всем советую! Высшее качество! Гидротест соответствует! Магаз решает все в пользу клиента! Не знаю, то-ли кладмены сытые. То-ли система контроля у них какая-то налаженная. В общем не бодяжат. Одним словом надёжно. Как в запазухе у Х! Gang bang rulit! ",А,1,бляять чувакиия стаффа просто чумава самый строгий мерка камень твёрдый орех заходить домой жечь противный запах цвет белоснежный советовать брать большой вес камень крупный деньга выгодный кладмена респект отдельный всё полочка разложить забор вообще бывать проблема это магазин весь советовать высокий качество гидротест соответствовать магаз решать всё польза клиент знать кладмена сытый система контроль наладить общий бодяжатый слово надёжно запазуха х gang bang rulit,VERB NOUN NOUN PART ADJ NUM ADP NUM ADP ADJ ADJ NOUN NOUN ADJ SCONJ NOUN VERB SCONJ ADP PRON ADV PRON PART VERB VERB ADJ NOUN NOUN ADJ VERB VERB ADJ NOUN ADV PART NOUN ADJ CCONJ ADP NOUN ADJ NOUN PROPN ADJ PRON ADP NOUN VERB ADP NOUN ADV PART VERB NOUN ADP DET NOUN PRON VERB ADJ NOUN NOUN VERB NOUN VERB PRON ADP NOUN NOUN PART VERB ADV NOUN ADJ ADV NOUN NOUN ADP PRON DET VERB ADP ADJ PART VERB NUM NOUN ADJ SCONJ ADP NOUN ADP PROPN PROPN PROPN PROPN
29,Не нашёл. Купон на 50% Дали. Магазин конечно старается,А,1,найти купон дать магазин стараться,PART VERB NOUN ADP NUM SYM VERB NOUN ADV VERB
30,"Спасибо, нашел. Фотографий много, определялся долго. Не в касание, и так далее. В целом неплохо, качество пойдёт, но есть лучше. Пацаны , надежно , качество на тройку",А,1,спасибо найти фотография определяться долго касание далее целое неплохо качество пойти хороший пацан надёжно качество тройка,NOUN VERB NOUN ADV VERB ADV PART ADP NOUN CCONJ ADV ADV ADP NOUN ADJ NOUN VERB CCONJ VERB ADJ NOUN ADV NOUN ADP NOUN
31,"К сожалению ненаход, но проблему уладили)",А,1,сожаление ненаход проблема уладить,ADP NOUN NOUN CCONJ NOUN VERB
32,"Забрал в касание, ещё не пробовал. Сам амф белоснежный. Конкретный недовес, диспут не стал открывать. По «настроению» дополню позже.",А,1,забрать касание ещё пробовать амф белоснежный конкретный недовес диспут стать открывать настроение дополнить поздний,VERB ADP NOUN ADV PART VERB ADJ NOUN ADJ ADJ NOUN NOUN PART VERB VERB ADP NOUN VERB ADV
33,"Это не станция Подлипки Дачные, а Мытищи Строитель!!!!!",А,1,это станция подлипка дачный мытищи строитель,PRON PART NOUN PROPN ADJ CCONJ PROPN PROPN
34,"Район указан не верно, погрешность просто зашкаливает, уж лучше бы просто обозначили ""город"". Товар за свою цену сойдёт, вес не проверял. -3 за неточное место.",А,1,район указать верно погрешность просто зашкаливать хороший просто обозначить город товар свой цена сойти вес проверять неточный место,NOUN VERB PART ADV NOUN PART VERB PART ADJ AUX PART VERB NOUN NOUN ADP DET NOUN VERB NOUN PART VERB NUM ADP ADJ NOUN
35,"Амф средний , за свою цену пойдёт У кладмена географический кретинизм Находился около станций строители",А,1,амф средний свой цена пойти кладмена географический кретинизм находиться около станция строитель,NOUN ADJ ADP DET NOUN VERB ADP NOUN ADJ NOUN VERB ADP NOUN NOUN
36,"Качество хорошее, поиски были на изи. Вот только небольшой недовес огорчил. Разрешить ситуацию не смогли. Впредь буду знать какие фото предоставлять в таких случаях! Процветания вам",А,1,качество хороший поиск изя небольшой недовес огорчить разрешить ситуация смочь впредь знать фото предоставлять случай процветание,NOUN ADJ NOUN AUX ADP NOUN PART PART ADJ NOUN VERB VERB NOUN PART VERB ADV AUX VERB DET NOUN VERB ADP DET NOUN NOUN PRON
37,Поднял в касание! За это спс! А вот качество хворает,А,1,поднять касание это спс качество хворать,VERB ADP NOUN ADP PRON NOUN CCONJ PART NOUN VERB
38,"хорошее место, настолько хорошее, что пришлось ждать, пока люди, которые приехали на пикник и находились в 2 метрах от клада свалят. но это даже украсило вечер. погуляли, пофоткали. приехали домой, кинули на весы. недовес 0.14 с грамма. округлим до минус 2 звёзд, с учётом, что это была покупка по купону после ненахода.",А,1,хороший место настолько хороший прийтись ждать пока человек который приехать пикник находиться метр клад свалить это украсить вечер погулять пофоткать приехать домой кинуть весы недовес грамм округлить минус звезда учёт это покупка купон ненаход,ADJ NOUN ADV ADJ PRON VERB VERB SCONJ NOUN PRON VERB ADP NOUN CCONJ VERB ADP NUM NOUN ADP NOUN VERB CCONJ PRON PART VERB NOUN VERB VERB VERB ADV VERB ADP NOUN NOUN NUM ADP NOUN VERB ADP NOUN NUM NOUN ADP NOUN SCONJ PRON AUX NOUN ADP NOUN ADP NOUN
