,content,Type,sentiment,preprocessed,pos_tags
550,"Клад в трубе диам 4 см. На глубине около 1 метра!! В очень! Многолюдном переходе! Магазин как обычно включает дурачка и предлагает прийти туда ночью с вилкой) реюята это - дно! Два подряд неудачных клада, закрываю сделку, подавитесь деньгами, засуньте их себе также глубоко. Требую платформу обратить внимание на магазин!! Вопросы не решает, отказывется приглашать модераторат, каким то чудом находится в топе. Много негатива.му . Да. Ки .",Л,-1,клад труба диам смотреть глубина около метр очень многолюдный переход магазин обычно включать дурачок предлагать прийти туда ночью вилка реюёнок это дно подряд неудачный клад закрывать сделка подавиться деньга засунуть также глубоко требовать платформа обратить внимание магазин вопрос решать отказываться приглашать модераторат чудом находиться топ негатив му ки,NOUN ADP NOUN NOUN NUM NOUN ADP NOUN ADP NUM NOUN ADP ADV ADJ NOUN NOUN ADV ADV VERB NOUN CCONJ VERB VERB ADV NOUN ADP NOUN ADJ PRON NOUN NUM ADV ADJ NOUN VERB NOUN VERB NOUN VERB PRON PRON ADV ADV VERB NOUN VERB NOUN ADP NOUN NOUN PART VERB VERB VERB NOUN DET DET NOUN VERB ADP NOUN ADV NOUN PART NOUN
551,"Ненаход. Слабый клад. Хамское и неадекватное общение с поддержкой. Каким то чудом магвзин в топе, злоупотребляет этим и не приглашает модератора. Км просто не выходит на связь. Два подряд ненахода. Минеры магазина это просто дно. Засуньте себе деньги . Клады с многочисленными нарушениями. Возле полиции, в подьездах. Просто жесть. Допускаю что может нам так не повезло и отзывов много хороших, по качеству тоже, но ге советовал бы рисковать временем и деньгами в этом магазине. Ругаться матом нельзя но вы этого заслуживаете. Дно",Л,-1,ненаход слабый клад хамский неадекватный общение поддержка чудом магвзина топ злоупотреблять это приглашать модератор км просто выходить связь подряд ненаход минёр магазин это просто дно засунуть деньга клад многочисленный нарушение возле полиция подьезд просто жесть допускать мочь повезти отзыв хороший качество ге советовать рисковать время деньга это магазин ругаться мат это заслуживать дно,NOUN ADJ NOUN ADJ CCONJ ADJ NOUN ADP NOUN DET DET NOUN NOUN ADP NOUN VERB PRON CCONJ PART VERB NOUN NOUN PART PART VERB ADP NOUN NUM ADV NOUN NOUN NOUN PRON PART NOUN VERB PRON NOUN PROPN ADP ADJ NOUN ADP NOUN ADP NOUN PART NOUN VERB PRON VERB PRON ADV PART VERB CCONJ NOUN ADV ADJ ADP NOUN PART CCONJ NOUN VERB AUX VERB NOUN CCONJ NOUN ADP DET NOUN VERB NOUN ADV CCONJ PRON PRON VERB NOUN
552,"Решил купить марки, по итогу ничего не нашли. Магазин предложил дать скидку в 50%, но так так я живу в другом городе, скидка мне ничего не даст. Очень жаль Так же хочу дополнить, что операторы очень долго работают!",Л,-1,решить купить марка итог наслать магазин предложить дать скидка жить друг город скидка дать очень жаль хотеть дополнить оператор очень долго работать,VERB VERB NOUN ADP NOUN PRON PART VERB NOUN VERB VERB NOUN ADP NUM SYM CCONJ ADV ADV PRON VERB ADP ADJ NOUN NOUN PRON PRON PART VERB ADV ADV ADV PART VERB VERB SCONJ NOUN ADV ADV VERB
553,"ненаход, магазин отказался давать пз или скидку, брал на следующий день и клад оказался на том же доме за углом спасибо хоть его нашел, магазином остался не доволен",Л,-1,ненаход магазин отказаться давать пз скидка брать следующий день клад оказаться дом угол спасибо найти магазин остаться довольный,NOUN NOUN VERB VERB NOUN CCONJ NOUN VERB ADP ADJ NOUN CCONJ NOUN VERB ADP DET PART NOUN ADP NOUN NOUN ADV PRON VERB NOUN VERB PART ADJ
554,"Ненаход, но на это пофиг. Вот то, что пришлось убегать от мужика, который был явно в курсе где клад, это полная жесть. Магазин со вчерашнего вечера никак это не прокомментировал, хотя мне в общем и не нужно от них. Просто рад что ноги унёс. Уже после прочитал отзывы, где других тоже принимали, так что будьте крайне внимательны.",Л,-1,ненаход это пофига прийтись убегать мужик который явно курс клад это полный жесть магазин вчерашний вечер никак это прокомментировать хотя общий нужно просто рад нога унести прочитать отзыв принимать крайне внимательный,NOUN CCONJ ADP PRON VERB PART PRON PRON VERB VERB ADP NOUN PRON AUX ADV ADP NOUN ADV NOUN PRON ADJ NOUN NOUN ADP ADJ NOUN ADV PRON PART VERB SCONJ PRON ADP ADJ PART PART ADJ ADP PRON PART ADJ SCONJ NOUN VERB ADV ADP VERB NOUN ADV ADJ PART VERB ADV SCONJ AUX ADV ADJ
555,"Доброго времени суток. Клада на месте не было, не наход и слава Богу, т.к. через 5 минут пришлось проследовать в ОВД. В общем, ошибка курьера было оставить на самом шкурном месте, но благодаря его ошибке, не пришлось отбывать срок ;) Открыли диспут, сказали что всё ок и всё на месте. Не рекомендую заказывать в Мск. Всем хорошего дня.",Л,-1,добрый время сутки клад место наход слава бог минута прийтись проследовать овд общий ошибка курьер оставить шкурный место благодаря ошибка прийтись отбывать срок открыть диспут сказать всё около всё место рекомендовать заказывать мск весь хороший день,ADJ NOUN NOUN NOUN ADP NOUN PART VERB PART NOUN CCONJ NOUN PROPN SCONJ ADP NUM NOUN VERB VERB ADP PROPN ADP ADJ NOUN NOUN AUX VERB ADP ADJ ADJ NOUN CCONJ ADP DET NOUN PART VERB VERB NOUN VERB NOUN VERB SCONJ DET NOUN CCONJ PRON ADP NOUN PART VERB VERB ADP PROPN DET ADJ NOUN
556,"Был ненаход, продавец предложил 50% скидку на следующую покупку, отказался, так как покупать что-то еще тут не никакого желания. История у меня хорошая, из 37 покупок, 3 из которых у Шивы был всего один ненаход в другом шопе, который решили сразу же. Клады, которые мне попадались все однотипные, что делает их шкуроходными. Поддержка отвечает очень долго и часто дублируют уже отправленные сообщения, весь диспут занял неделю, по сообщению в день. Накипело. Брал у Шивы еще на РАМПе, думал, что и тут магазин- ТОП. Однако ошибся.",Л,-1,ненаход продавец предложить скидка следующий покупка отказаться покупать ещё никакой желание история хороший покупка который шив весь ненаход друг шоп который решить сразу клад который попадаться всё однотипный делать шкуроходный поддержка отвечать очень долго часто дублировать отправить сообщение весь диспут занять неделя сообщение день накипеть брать шив ещё рампа думать магазин топ однако ошибиться,AUX NOUN NOUN VERB NUM SYM NOUN ADP ADJ NOUN VERB ADV ADV VERB PRON ADV ADV PART DET NOUN NOUN ADP PRON ADJ ADP NUM NOUN NUM ADP PRON ADP PROPN AUX PART NUM NOUN ADP ADJ NOUN PRON VERB ADV PART NOUN PRON PRON VERB DET ADJ PRON VERB PRON ADJ NOUN VERB ADV ADV CCONJ ADV VERB ADV VERB NOUN DET NOUN VERB NOUN ADP NOUN ADP NOUN VERB VERB ADP PROPN ADV ADP NOUN VERB SCONJ PART ADV NOUN PROPN ADV VERB
557,"парни, не теряйте время и деньги, утверждать не буду, но на пролетарской, на кладнике, ссаный, ублюдский овощ, искрене желаю, что б его жизнь была такой класной как и его адреса, брал первый раз адрес у них, не наход,перезаклад нетделали, отделались купоном ра скидку, взял втрой адрес к них, с купоном на скидку, не чего не нашел, место говно, магнит в трубе...) =))) перезаклад не делают, отпровляют под копирку сообщения, и разряда, ситуация спорная... не рекомендую!! спасибо",Л,-1,парень терять время деньга утверждать пролетарский кладник ссаный ублюдский овощ искрен желать б жизнь класна адрес брать первый адрес наход перезаклад нетделать отделаться купон ра скидка взять втрой адрес купон скидка найти место говно магнит труба перезаклад делать отпровлять копирка сообщение разряд ситуация спорный рекомендовать спасибо,NOUN PART VERB NOUN CCONJ NOUN VERB PART AUX CCONJ ADP ADJ ADP NOUN ADJ ADJ NOUN PRON VERB SCONJ AUX DET NOUN AUX DET ADJ SCONJ PART DET NOUN VERB ADJ NOUN NOUN ADP PRON PART NOUN VERB NOUN VERB NOUN ADJ NOUN VERB ADJ NOUN ADP PRON ADP NOUN ADP NOUN PART PRON PART VERB NOUN NOUN NOUN ADP NOUN SYM VERB PART VERB VERB ADP NOUN NOUN CCONJ NOUN NOUN ADJ PART VERB NOUN
558,"ненаход. Клад был далеко в лесу, при этом в людном месте, пришлось копать на глазах у лыжников. Место нашел сразу, раскопки производил аккуратно просеивая снег. Магазин не возместил из-за того, что новый аккаунт. Позиция магазина - клиент плохо искал, клад на месте. Позиция клиента - клад если и был там, то заложен был плохо.",Л,-1,ненаход клад далеко лес это людный место прийтись копать глаз лыжник место найти сразу раскопка производить аккуратно просеивать снег магазин возместить новый аккаунт позиция магазин клиент плохо искать клад место позиция клиент клад заложить плохо,NOUN NOUN AUX ADV ADP NOUN ADP PRON ADP ADJ NOUN VERB VERB ADP NOUN ADP NOUN NOUN VERB ADV NOUN VERB ADV VERB NOUN NOUN PART VERB ADP PRON SCONJ ADJ NOUN NOUN NOUN NOUN ADV VERB NOUN ADP NOUN NOUN NOUN NOUN SCONJ PART AUX ADV SCONJ VERB AUX ADV
559,Клада на месте нет. Позже дополню,Л,-1,клад место поздний дополнить,NOUN ADP NOUN VERB ADV VERB
560,"Клад не найден. Диспут не открывал, т.к ребята всё равно не делают перезаклад. Видимо км сам съел. - 1900 руб.",Л,-1,клад найти диспут открывать ребята всё равно делать перезаклад видимо км съесть руб,NOUN PART VERB NOUN PART VERB PRON ADP NOUN PRON ADJ PART VERB NOUN ADV NOUN ADJ VERB NUM NOUN
561,Не рекомендую,Л,-1,рекомендовать,PART VERB
562,Ничего не нашёл 2 фото с левого,Л,-1,найти фото левый,PRON PART VERB NUM NOUN ADP ADJ
563,саппорт просто игнорит вопросы возникшие по кладу.,Л,-1,саппорт просто игнорита вопрос возникнуть класть,NOUN PART VERB NOUN VERB ADP VERB
564,"Ненаход. Три раза ходили на место - нету там ничего, копали - рыли ничего. Оценка 0",Л,-1,ненаход ходить место нету копать рыть оценка,NOUN NUM NOUN VERB ADP NOUN VERB ADV PRON VERB VERB PRON NOUN NUM
565,"Место под марки- лес, прикоп, 10-15 см, на ровной земле. 0/10 Так ещё и на единственном входе в лес полиция... В пизду такие клады",Л,-1,место марка лес прикопа смотреть ровный земля ещё единственный вход лес полиция пизда клад,NOUN ADP NOUN NOUN NOUN NUM NUM NOUN ADP ADJ NOUN NUM NUM ADV ADV PART ADP ADJ NOUN ADP NOUN NOUN ADP NOUN DET NOUN
566,"не нашел клад, вопрос решили не в мою пользу. думал шива не такая...",Л,-1,найти клад вопрос решить польза думать шив,PART VERB NOUN NOUN VERB PART ADP DET NOUN VERB NOUN PART DET
567,"Сделал одновременно 2 заказа. С первым все было отлично. Место хорошее, клад забрал махом. Со вторым сразу все было ни как надо. Не было фото, описание не совсем ясное. Ответили на следующий день, фото тоже прислали. Но вот клад не нашел, не потому что не там искал, а потому что его не было. Приезжал на место 3 раза. Всякое возможно, но скорее всего кладмен не чист на руку, ибо сразу возникли косяки с его стороны.",Л,-1,сделать одновременно заказ первый всё отлично место хороший клад забрать мах второй сразу всё фото описание ясный ответить следующий день фото прислать клад найти искать приезжать место всякий возможно скорее весь кладмена чистый рука ибо сразу возникнуть косяк сторона,VERB ADV NUM NOUN ADP ADJ PRON AUX ADJ NOUN ADJ NOUN VERB NOUN ADP ADJ ADV PRON AUX PART ADV ADV PART VERB NOUN NOUN PART ADV ADJ VERB ADP ADJ NOUN NOUN PART VERB CCONJ PART NOUN PART VERB PART ADV SCONJ PART ADV VERB CCONJ ADV SCONJ PRON PART VERB VERB ADP NOUN NUM NOUN DET ADJ CCONJ ADV PRON NOUN PART ADJ ADP NOUN SCONJ ADV VERB NOUN ADP DET NOUN
568,"Ненаход. Магазин, к сожалению, на встречу не пошел.",Л,-1,ненаход магазин сожаление встреча пойти,NOUN NOUN ADP NOUN ADP NOUN PART VERB
569,"Клад сделали спустя четверо суток и вовсе не в указаном городе. В описании предлагали пройтись по заледеневшему болоту - наутро заболело горло. В общем, не рекомендую, вообще непонятно чем руководствуются, когда делают клады.",Л,-1,клад сделать спустя четверо сутки вовсе указан город описание предлагать пройтись заледенеть болото наутро заболеть горло общий рекомендовать вообще непонятно руководствоваться делать клад,NOUN VERB ADP NUM NOUN CCONJ ADV PART ADP VERB NOUN ADP NOUN VERB VERB ADP VERB NOUN ADV VERB NOUN ADP ADJ PART VERB ADV ADJ PRON VERB SCONJ VERB NOUN
570,ненаход. клад сошкурен. выходные испорчены. и да,Л,-1,ненаход клад сошкурить выходной испортить,NOUN NOUN VERB NOUN VERB CCONJ PART
571,"Ненаход 3х штук ЛСД. Грешу на шкуроходов, т.к. место мегапалевное - прямо во дворе нескольких домов, под окном одной из квартир, в 3х метрах от детской площадки и входа в детский центр. В любое время дня и ночи ходят толпы мам, пап, детей, дворников и пр. Долго настаивать в диспуте на своей правоте не стал, т.к. скоро новый год и портить себе настроение ппц как не охота.Да и с моими несколькими покупками на гидре доказать вряд ли что- то получится. Так что, ребят, осторожнее, если покупаете что-то в этом магазе в районе м. Волжская.",Л,-1,ненаход 3х штука лсд грешить шкуроход место мегапалевной прямо двор несколько дом окно квартира 3х метр детский площадка вход детский центр любой время день ночь ходить толпа мама папа ребёнок дворник пр долго настаивать диспут свой правота стать скоро новый год портить настроение ппц охота несколько покупка гидра доказать вряд получиться ребята осторожный покупать это магаза район м волжский,NOUN NUM NOUN PROPN VERB ADP NOUN SCONJ NOUN ADJ ADV ADP NOUN NUM NOUN ADP NOUN NUM ADP NOUN ADP NUM NOUN ADP ADJ NOUN CCONJ NOUN ADP ADJ NOUN ADP DET NOUN NOUN CCONJ NOUN VERB NOUN NOUN NOUN NOUN NOUN CCONJ NOUN ADV VERB ADP NOUN ADP DET NOUN PART VERB SCONJ ADV ADJ NOUN CCONJ VERB PRON NOUN NOUN ADV PART VERB CCONJ ADP DET NUM NOUN ADP NOUN VERB ADV PART PRON PART VERB ADV SCONJ NOUN ADJ SCONJ VERB PRON ADP DET NOUN ADP NOUN NOUN ADJ
572,Ненаход.,Л,-1,ненаход,NOUN
573,"К сожалению клад не был найден,покупок не хватило на какое либо решение.Испорченные праздники,решайте сами,а так правила есть правила.",Л,-1,сожаление клад найти покупка хватить либо решение испортить праздник решать правило правило,ADP NOUN NOUN PART AUX VERB NOUN PART VERB ADP DET CCONJ NOUN VERB NOUN VERB ADJ CCONJ ADV NOUN VERB NOUN
574,"Клад не найден , место эпик палевное , сервис стал работать плохо очень жаль (",Л,-1,клад найти место эпик палевной сервис стать работать плохо очень жаль,NOUN PART VERB NOUN NOUN ADJ NOUN VERB VERB ADV ADV ADV
575,Пустые это кидалово пипец 10₽подарил,Л,-1,пустой это кидалово пипец подарить,ADJ PRON ADJ NOUN VERB
576,Въебали с подругой по пол марки. Эффекта почти 0,Л,-1,въебали подруга пол марка эффект,VERB ADP NOUN ADP NUM NOUN NOUN ADV NUM
577,"Кинули на товар, предложили 50%, нашли Лоха второй раз им денги отдавать. Первая покупка и сразу не наход. Покупаете тут на свой страх и риск, будьте умнее и использование проверенные магазины.",Л,-1,кинуть товар предложить наслать лох второй денги отдавать первый покупка сразу наход покупать свой страх риск умный использование проверить магазин,VERB ADP NOUN VERB NUM SYM VERB PROPN ADJ NOUN PRON NOUN VERB ADJ NOUN CCONJ ADV PART NOUN VERB ADV ADP DET NOUN CCONJ NOUN AUX ADJ CCONJ NOUN VERB NOUN
578,"С четвертой попытки нашли клад. Ребят, закупите магниты, коль кладете в жилом секторе. Как то не очень капать в нескольких метрах от окон домов. По качеству позже.",Л,-1,четвёртый попытка наслать клад ребята закупить магнит коль класть жилой сектор очень капать несколько метр окно дом качество поздний,ADP ADJ NOUN VERB NOUN NOUN VERB NOUN PRON VERB ADP ADJ NOUN ADV PRON PART ADV VERB ADP NUM NOUN ADP NOUN NOUN ADP NOUN ADV
579,"Не рекомендую брать позиции на магнитах, так как был ненаход. В подъезде валялся разорванный и опустошенный пак. Магазин предложил 50% скидку после 3-ей покупки, перезакладов не дают.",Л,-1,рекомендовать брать позиция магнит ненаход подъезд валяться разорвать опустошить пак магазин предложить скидка покупка перезаклад давать,PART VERB VERB NOUN ADP NOUN ADV SCONJ AUX ADJ ADP NOUN VERB VERB CCONJ VERB NOUN NOUN VERB NUM SYM NOUN ADP ADJ NOUN NOUN PART VERB
580,"Курьер скинул всего 1 фотку с крупным планом кустика в полумраке, по которой вообще нереально что-либо найти. А уж после того как выпал снег... Найти было сложно, пришлось помучиться. Марочки упакованы в огрызок сигаретной фольги и один зиплок. Всё! Прозрачный зиплок с маленькой блёсткой внутри - тупо не стал запариваться парень. О качестве даже думать боюсь при таком подходе, проверить пока не успел.",Л,-1,курьер скинуть весь фотка крупный план кустик полумрак который вообще нереально либо найти выпасть снег найти сложно прийтись помучиться марочка упаковать огрызок сигаретный фольга зиплка всё прозрачный зиплка маленький блёстка внутри тупо стать запариваться парень качество думать бояться подход проверить пока успеть,NOUN VERB PART NUM NOUN ADP ADJ NOUN NOUN ADP NOUN ADP PRON ADV ADJ PRON VERB CCONJ PART ADP PRON SCONJ VERB NOUN VERB AUX ADJ VERB VERB NOUN VERB ADP NOUN ADJ NOUN CCONJ NUM NOUN PRON ADJ NOUN ADP ADJ NOUN ADV ADV PART VERB VERB NOUN ADP NOUN PART VERB VERB ADP DET NOUN VERB ADV PART VERB
581,ненаход. дали скидку,Л,-1,ненаход дать скидка,NOUN VERB NOUN
