,content,Type,sentiment,preprocessed,pos_tags
823,ребятки забрала в касаху!!! ну не зря покемон ебашит в топе))) сами таблы хорошие опытным можно сразу целую кушать)))),МД,1,ребятки забрать касаха зря покемон ебашитый топ табла хороший опытный сразу целый кушать,NOUN VERB ADP NOUN PART PART ADV NOUN VERB ADP NOUN ADJ NOUN ADJ ADJ ADV ADV ADJ VERB
824,"Всё гуд, радуете",МД,1,всё гуд радовать,PRON NOUN VERB
825,"Попалось что то типо синее сердечко с какимита стрелочка и, скажу улёт внатуре как заявлено чистый мдма не мажет. Прёт уже часа 3,30 но держит збс.",МД,1,попасться типо синий сердечко какимит стрелочка сказать улёт внатура заявить чистый мдм мазать переть час держать збс,VERB SCONJ PRON ADV ADJ NOUN ADP DET NOUN CCONJ VERB NOUN NOUN SCONJ VERB ADJ NOUN PART VERB VERB ADV NOUN NUM CCONJ VERB NOUN
826,Могло быть и лучше. Но суппорт не забывает про покупателей и это очень радует. Если что осторожней на унц. Там бульдозеролюди какие-то орудуют,МД,1,мочь хороший суппорт забывать покупатель это очень радовать осторожный унц бульдозеролюдить орудовать,VERB VERB PART ADJ CCONJ NOUN PART VERB ADP NOUN CCONJ PRON ADV VERB SCONJ PRON ADJ ADP NOUN ADV NOUN DET VERB
827,"Касание, хорошее место, но нужно правильно выбирать время. Кач пушка, знакомые таблеточки. Магазину - добра. Кладмену - чаевых.",МД,1,касание хороший место нужно правильно выбирать время кач пушка знакомый таблеточка магазин добро кладмена чаевой,NOUN ADJ NOUN CCONJ ADJ ADV VERB NOUN NOUN NOUN ADJ NOUN NOUN NOUN NOUN ADJ
828,"В общем.это было не легко, что бы добраться до места пришлось промокнуть полностью и влезть в грязь ночью такие вещи лучше не делать... минер с брендил там места куча куда можно спрятать так нет же надо в самую жопу было тыкать, а по качеству все ровно ...",МД,1,общий это легко добраться место прийтись промокнуть полностью влезть грязь ночью вещь хороший делать минёр брендил место куча спрятать самый жопа тыкать качество всё ровно,ADP ADJ PRON AUX PART ADJ SCONJ AUX VERB ADP NOUN VERB VERB ADV CCONJ VERB ADP NOUN NOUN DET NOUN ADJ PART VERB NOUN ADP NOUN ADV NOUN NOUN ADV ADV VERB ADV PART PART ADV ADP ADJ NOUN AUX VERB CCONJ ADP NOUN PRON ADV
829,"Все отлично, быстро нашел, безлюдно.",МД,1,всё отлично быстро найти безлюдно,PRON ADJ ADV VERB ADV
830,Все классно в касание,МД,1,всё классно касание,PRON ADJ ADP NOUN
831,"У всех бывают неполадки в работе, взяли адрес, приехали, карды не те, но благодаря отличному сервису магаза нам все исправили и вуаля, подъем в касание!) Хотелось бы поставить 20 из 10 за своевременную сервисную поддержку магазина, ребята красавчики, борются до последнего за своего клиента, а это самый главный залог успеха, так держать парни!",МД,1,весь бывать неполадка работа взять адрес приехать карда благодаря отличный сервис магаза всё исправить вуаля подъём касание хотеться поставить своевременный сервисный поддержка магазин ребята красавчик бороться последний свой клиент это самый главный залог успех держать парень,ADP PRON VERB NOUN ADP NOUN VERB NOUN VERB NOUN PART DET CCONJ ADP ADJ NOUN NOUN PRON PRON VERB CCONJ NOUN NOUN ADP NOUN VERB AUX VERB NUM ADP NUM ADP ADJ ADJ NOUN NOUN NOUN NOUN VERB ADP ADJ ADP DET NOUN CCONJ PRON ADJ ADJ NOUN NOUN ADV VERB NOUN
832,Всё чики пуки,МД,1,всё чик пук,PRON NOUN NOUN
833,"Чётко и быстро , гуд",МД,1,чётко быстро гуд,ADV CCONJ ADV NOUN
834,"Прогулялся на славу, снял в секунду, 10/10 оекпект",МД,1,прогуляться слава снять секунда оекпект,VERB ADP NOUN VERB ADP NOUN NUM NUM NOUN
835,"Товар получен! Колёсики (Майбахи) - вышка! Тут вопросов нет! А вот сам квест получился двухсерийным! Вбили координаты с детального фото. Пришли на точку, а там ничего похожего нет!!! Уже спустя 10 мин, на обзорном фото обнаружили, что координаты совсем другого места с разницей в 1,5 км!!! КМ, давай не дури и не гоняй покупателей по лесам!!! Буду признателен магазину, если в разделе скидок случайно обнаружу скормную компенсацию за доставленные неудобства. Всем добра!",МД,1,товар получить колёсико майбах вышка вопрос квест получиться двухсерийный вбить координата детальный фото прислать точка похожий спустя мина обзорный фото обнаружить координата место разница км км давать дурь гонять покупатель леса признательный магазин раздел скидка случайно обнаружить скормный компенсация доставить неудобство весь добро,NOUN VERB NOUN PROPN NOUN ADV NOUN VERB CCONJ PART ADJ NOUN VERB ADJ VERB NOUN ADP ADJ NOUN VERB ADP NOUN CCONJ ADV PRON ADJ VERB ADV ADP NUM NOUN ADP ADJ NOUN VERB SCONJ NOUN ADV ADJ NOUN ADP NOUN ADP NUM NOUN NOUN VERB PART NOUN CCONJ PART VERB NOUN ADP NOUN AUX ADJ NOUN SCONJ ADP NOUN NOUN ADV VERB ADJ NOUN ADP VERB NOUN DET NOUN
836,"Забрал быстро, но прикоп так себе, не очень надëжный. По качеству очень спидово, ждал 2 часа пока въебëт, в целом неплохо)",МД,1,забрать быстро прикопа очень надëжный качество очень спидовый ждать час пока въебëт целое неплохо,VERB ADV CCONJ ADV ADV PRON PART ADV ADJ ADP NOUN ADV ADV VERB NUM NOUN ADV NOUN ADP NOUN ADJ
837,"касание, по качу не скажу, брал не себе",МД,1,касание кача сказать брать,NOUN ADP NOUN PART VERB VERB PART PRON
838,"Забрал, попались монклеры, не побывал, может дополню если будем сегодня ставить пробы",МД,1,забрать попасться монклер побывать мочь дополнить сегодня ставить проба,VERB VERB NOUN PART VERB VERB VERB SCONJ AUX ADV VERB NOUN
839,"К сожалению ненаход, но магазин быстро и оперативно ответил, дали купон Магазину всех благ",МД,1,сожаление ненаход магазин быстро оперативно ответить дать купон магазин весь благо,ADP NOUN NOUN CCONJ NOUN ADV CCONJ ADV VERB VERB NOUN PROPN DET NOUN
840,"брал не себе,снято в касание,качало нормально,спасибо)",МД,1,брать снятой касание качать нормально спасибо,VERB PART PRON VERB ADP NOUN VERB ADV NOUN
841,"Отличное качество двух фотографий сразу дало чувство эйфории! Вот ты бы у всех магазинов были такие четкие координаты и фотки. Круглые попались синенькие треугольной формы,целые! Упаковка идеальная! НО всегда будьте на чеку,ведь ребята в погонах стали любители гулять по лесам. . . И Силикатный тому не исключение. . . Покемон спасибки)))))",МД,1,отличный качество фотография сразу дать чувство эйфория весь магазин чёткий координата фотка круглый попасться синенький треугольный форма целый упаковка идеальный чек ребята погон стать любитель гулять леса силикатный исключение покемон спасибка,ADJ NOUN NUM NOUN ADV VERB NOUN NOUN PART PRON AUX ADP DET NOUN AUX DET ADJ NOUN CCONJ NOUN ADJ VERB ADJ ADJ NOUN ADJ NOUN ADJ CCONJ ADV AUX ADP NOUN SCONJ NOUN ADP NOUN VERB NOUN VERB ADP NOUN CCONJ ADJ PRON PART NOUN NOUN NOUN
842,Клад подобран. Место неудачное совсем - у окон 1 этажа дома и рядом с дорогой.,МД,1,клад подобрать место неудачный окно этаж дом рядом дорога,NOUN VERB NOUN ADJ ADV ADP NOUN NUM NOUN NOUN CCONJ ADV ADP NOUN
843,"все четко , км спасибо за район ждем позици побольше на правом ) в этот раз зеленая попалась)",МД,1,всё чётко км спасибо район ждать позици большой право зелёный попасться,PRON ADV NOUN NOUN ADP NOUN VERB NOUN ADV ADP NOUN ADP DET NOUN ADJ VERB
844,Все ок!! На месте! !!,МД,1,всё около место,PRON NOUN ADP NOUN
845,Уже метр на метр раскопал,МД,1,метр метр раскопать,ADV NOUN ADP NOUN VERB
846,Лес был до ужаса мокрый стаи голодных Комаров но все на месте вечер удался !,МД,1,лес ужас мокрый стая голодный комар всё место вечер удаться,NOUN AUX ADP NOUN ADJ NOUN ADJ PROPN CCONJ PART ADP NOUN NOUN VERB
847,"Покемон, прекращаешь удивлять... Все в касание) все легчайше",МД,1,покемон прекращать удивлять всё касание всё легчайше,NOUN VERB VERB PRON ADP NOUN PART ADJ
848,"координаты врали слишком сильно, показывало далеко другое место, рылся по кустам в парке на людях. упаковка плохая, замотали таблы в пищевую пленку и сверху изоленты намотали. все 3 из 3 таблеток были поломаны, одна раздавлена в порошок. по качу хорошие",МД,1,координата врать слишком сильно показывать далеко место рыться куст парка человек упаковка плохой замотать табла пищевой плёнка сверху изолента намотать всё таблетка поломать раздавить порошок кача хороший,NOUN VERB ADV ADV VERB ADV ADJ NOUN VERB ADP NOUN ADP NOUN ADP NOUN NOUN ADJ VERB NOUN ADP ADJ NOUN CCONJ ADV NOUN VERB PART NUM ADP NUM NOUN AUX VERB NUM VERB ADP NOUN ADP NOUN ADJ
849,"Брал сердца, забрал в касание, магазин лучший в своём деле, Кура красава все сделал как надо, пока не пробовал",МД,1,брать сердце забрать касание магазин хороший свой дело кура красава всё сделать пока пробовать,VERB NOUN VERB ADP NOUN NOUN ADJ ADP DET NOUN PROPN NOUN PRON VERB ADV ADV ADV PART VERB
850,"Клад сделан очень красиво, куре 10 за креатив. Приход плавный и запоминающийся. Ещё забегу!",МД,1,клад сделать очень красиво кура креатив приход плавный запоминаться ещё забег,NOUN VERB ADV ADV NOUN NUM ADP NOUN NOUN ADJ CCONJ VERB ADV NOUN
851,Спасибо все отлично ),МД,1,спасибо всё отлично,NOUN PRON ADJ
852,"Пришел, нашел, поднял и уехал. Всем спасибо:)",МД,1,прийти найти поднять уехать весь спасибо,VERB VERB VERB CCONJ VERB DET NOUN
853,Прет ООООЧЕНЬ хорошо. Клад в надежном месте. Магазин рекомендую! Кладмен свое дело знает !,МД,1,переть оооочень клад надёжный место магазин рекомендовать кладмена свой дело знать,VERB ADV ADV NOUN ADP ADJ NOUN NOUN VERB NOUN DET NOUN VERB
854,В касашку,МД,1,касашка,ADP NOUN
855,"Все дома, но слишком нудобно спрятано, пришлось повозюкаться",МД,1,всё дом слишком нудобный спрятать прийтись повозюкаться,DET NOUN CCONJ ADV ADV VERB VERB VERB
856,Всё чётко 10/10,МД,1,всё чётко,PRON ADV NUM NUM
857,"Конечно этот тоже на месте, курьер перепутал,’но смекалистые ребята нашли а и по стафуу пойдут диски",МД,1,место курьер перепутать смекалистый ребята наслать стафуа пойти диск,ADV DET PART ADP NOUN NOUN VERB SCONJ ADJ NOUN VERB CCONJ PART ADP NOUN VERB NOUN
858,Касание,МД,1,касание,NOUN
859,"Все чётко, в касание, приехал за кладом в удобное для меня время и все на месте, квест понравился. По качеству не отпишу ибопробовать будут не на этой неделе даже... Надеюсь все чётко будет, попались монклеры. Спасибо команде покепокепокемон за проделанную работу.",МД,1,всё чётко касание приехать клад удобный время всё место квест понравиться качество отписать ибопробовать неделя надеяться всё чётко попасться монклер спасибо команда покепокепокемон проделать работа,PRON ADV ADP NOUN VERB ADP NOUN ADP ADJ ADP PRON NOUN CCONJ PRON ADP NOUN NOUN VERB ADP NOUN PART VERB VERB AUX PART ADP DET NOUN PART VERB PRON ADV VERB VERB NOUN NOUN NOUN NOUN ADP VERB NOUN
860,"Все отлично,клетка в птичке,съем лёгкий,тихое спокойное место, процветания куре и команде,забегу к вам ещё",МД,1,всё отлично клетка птичка съесть лёгкий тихий спокойный место процветание кура команда забег ещё,PRON ADJ NOUN ADP NOUN NOUN ADJ ADJ ADJ NOUN NOUN NOUN CCONJ NOUN NOUN ADP PRON ADV
861,"все в все чики пуки, попались розовые монклеры, ебооооошит не по детски, съели по целой, ждали час, потом как нахуууярило, ебать плюющит, аахахаххах, я вас люблю",МД,1,всё всё чик пук попасться розовый монклер ебооооошить детски съесть целый ждать час нахуууярить ебать плюющит аахахахха любить,PRON ADP DET NOUN NOUN VERB ADJ NOUN NOUN PART ADP ADV VERB ADP ADJ VERB NOUN ADV ADV VERB VERB VERB NOUN PRON PRON VERB
862,"Пришлось немного повозиться пока искал, но нашел, Диски норм, года полтора не хавал так что толера не было через 23 минуты начало накрывать, но странно было то что еще через 40 мин отпустило, и пол часа вообще ничего не происходило. И я решил завать вторую-не делайте так :)",МД,1,прийтись немного повозиться пока искать найти диск норма год полтора хавал толера минута начало накрывать странно ещё мина отпустить пол час вообще происходить решить завать второй делать,VERB ADV VERB ADV VERB CCONJ VERB PROPN NOUN NOUN NUM PART VERB ADV SCONJ NOUN PART VERB ADP NUM NOUN VERB VERB CCONJ ADJ AUX PRON PRON ADV ADP NUM NOUN VERB CCONJ NUM NOUN ADV PRON PART VERB CCONJ PRON VERB VERB ADJ VERB ADV
863,Косание. всё ок,МД,1,косание всё около,NOUN PRON NOUN
864,"Добрейшего денёчка))) Взяли вчера одну ешку, чтобы по половине закинуться в честь окончания трехдневного марафона ахахахах. Сидели гадали, возьмёт или нет, я пока лежала даже успела погрузиться в ленту новостей вк и забыла, что вообще ешку съело. Забыла до тех пор пока не встала покурить и не поняла, что я убитая в ноль. НОЛЬ. 0. С ПОЛОВИНЫ......... После поспали часов 6. Просыпаюсь, подхожу к зеркалу, а у меня зрачки до сих пор размером с планеты)))) Качество достойное получается, мрррр. После покупки возникла проблема: кура забыл фото прикрепить, ни координатов, ничего ахахахх. Проблему решили оперативно, зая-кладмен кучу раз извинялся. Ничего, всякое бывает. Место клада, кстати, не палевное, да и сошкурить бы вряд ли додумались. Ну а я пойду заныхаюсь (дада, было ошибкой думать, что марафон закончен). Всем кискам пис, всем пискам кис!!))))))",МД,1,добрый денёчек взять вчера ешка половина закинуться честь окончание трёхдневный марафон ахахахи сидеть гадать взять пока лежать успеть погрузиться лента новость вк забыть вообще ешка съесть забыть пора пока встать покурить понять убитый ноль ноль половина поспасть час просыпаться подходить зеркало зрачок сей пора размер планета качество достойный получаться мрррра покупка возникнуть проблема кура забыть фото прикрепить координат ахахахха проблема решить оперативно зая кладмена куча извиняться всякий бывать место клад кстати палевной сошкурить вряд додуматься пойти заныхаяться дада ошибка думать марафон закончить весь киска пис весь писк киса,ADJ NOUN VERB ADV NUM NOUN SCONJ ADP NOUN VERB ADP NOUN NOUN ADJ NOUN NOUN VERB VERB VERB CCONJ PART PRON ADV VERB PART VERB VERB ADP NOUN NOUN NOUN CCONJ VERB SCONJ ADV NOUN VERB VERB ADP DET NOUN ADV PART VERB VERB CCONJ PART VERB SCONJ PRON VERB ADP NOUN NOUN NUM ADP NOUN ADP NOUN NOUN NUM VERB VERB ADP NOUN CCONJ ADP PRON NOUN ADP DET NOUN NOUN ADP NOUN NOUN ADJ VERB ADV ADP NOUN VERB NOUN NOUN VERB NOUN VERB CCONJ NOUN PRON NOUN NOUN VERB ADV NOUN NOUN NOUN NOUN VERB PRON DET VERB NOUN NOUN ADV PART ADJ CCONJ PART VERB AUX ADV PART VERB PART CCONJ PRON VERB VERB INTJ AUX NOUN VERB SCONJ NOUN VERB DET NOUN NOUN DET NOUN NOUN
865,"Впервые взял в этом магазине, съем легкий, тайник хороший) но было бы здорово сделать фото самого тайника, не сразу догадался, где именно лежит. Место не сказал бы что очень далеко - нормально, но в этом месте очень многие делают мины. Координаты точные. Попались зеленые треугольники МММ. Ну что, Покемон, проверим заряд твоих Пикачу)) Дополню отзыв, если качество не устроит. Пока все десятки ваши",МД,1,впервые взять это магазин съесть лёгкий тайник хороший здорово сделать фото тайник сразу догадаться именно лежать место сказать очень далеко нормально это место очень многие делать мина координата точный попасться зелёный треугольник ммм покемон проверить заряд твой пикача дополнить отзыв качество устроить пока всё десятка ваш,ADV VERB ADP DET NOUN VERB ADJ NOUN ADJ CCONJ AUX AUX ADJ VERB NOUN ADJ NOUN PART ADV VERB ADV PART VERB NOUN PART VERB AUX PRON ADV ADV ADJ CCONJ ADP DET NOUN ADV NUM VERB NOUN NOUN ADJ VERB ADJ NOUN PROPN PART PRON PROPN VERB NOUN DET PROPN VERB NOUN SCONJ NOUN PART VERB ADV DET NOUN DET
866,"Кладмен красава, хорошее исполнение тайником. Сьём в полкасания, по объёму даже больше табла было, респект за щедрость. Стаф прущий, добротное колесо. Советую. Магазину добра))",МД,1,кладмена красава хороший исполнение тайник сьё полкасание объём большой табла респект щедрость стафа переть добротный колесо советовать магазин добро,NOUN NOUN ADJ NOUN NOUN NOUN ADP NOUN ADP NOUN PART ADV NOUN VERB VERB ADP NOUN NOUN ADJ ADJ NOUN VERB NOUN NOUN
867,Клад подобрал в касание!Клад мену респект.Таблетки качают,МД,1,клад подобрать касание клад мена респект таблетка качать,NOUN VERB ADP NOUN NOUN VERB NOUN NOUN VERB
868,"Все супер, пришёл, увидел, победил. Диски рабочие",МД,1,всё супер прийти увидеть победить диск рабочий,PRON NOUN VERB VERB VERB NOUN NOUN
869,Всё просто великолепно.,МД,1,всё просто великолепно,PRON PART ADJ
